title,lyrics
ddu-du-ddu-du,"blackpink! ah yeah, ay yeah! blackpink! ah yeah, ay yeah! 1 a kind face and an attitude that isn’t a volume twice the size hidden in a slender figure relentlessly going forward, not caring what other people think when you say black we say pink, we are pretty savage 2 when we want, we’ll steal outright whatever you do, it’s like cutting water with a knife our hands are full of a fat check if you’re curious, fact check my expectations are higher it’s like fish in water i’m a little toxic you’ve for me, i`m foxy think twice i can’t act nice like other people don’t be mistaken i only smile easily for myself you may not know well yet if you want then test me you’re so predictable if you wanted something easy oh wait til’ i do what i do hit you with that ddu-du ddu-du du ah yeah, ay yeah! hit you with that ddu-du ddu-du du ah yeah, ay yeah! 2 the path i walk now blackpink 4 way intersection north south east west, ways run it of your bucket list i bought it pulling you and pushing you far away i do it however i want because i’m a bad girl whether you like me or hate me or whatever anyone says when the bass drop it’s another banger think twice i can’t act nice like other people don’t be mistaken i only smile easily for myself you may not know well yet if you want then test me you’re so predictable if you wanted something easy oh wait til’ i do what i do hit you with that ddu-du ddu-du du ah yeah, ay yeah! hit you with that ddu-du ddu-du du ah yeah, ay yeah! what you gonna do when i come come through with that that uh uh huh what you gonna do when i come come through with that that uh uh huh hot hot hot like fire hot hot hot like fire drop blackpink! hey! ah yeah, ay yeah! ah yeah, ay yeah! hot hot hot like fire hot hot hot like fire hit you with that ddu-du ddu-du du"
dont-know-what-to-do,"1 can someone stop time for a bit i feel like a big mistake just happened i tried to laugh it off awkwardly but i pity myself 1 i say i am fine but don’t know what to do without you i am left alone in this trivial place i picture your memories, they’re blue 2 people change why am i like this? on a pretty day like this how is everything difficult don’t know what to do i don’t know what to do without you yeah, hey, hey i don’t know what to do without you yeah, hey, hey i don’t know what to do without you you, you, you you know i don’t know what to do i don’t know what to do without you 2 like people who came and went i guess we just weren’t meant to be wondering if the phone might ring i hate myself for anticipating uselessly the tick tock of my clock is bothering me 1 i might seem fine but don’t know what to do without you i wonder if my feelings will be shown in the mirror the lips i’ve drawn are blue 2 i’m comfortable alone i’m just like that on a pretty day like this how is everything difficult don’t know what to do i don’t know what to do without you i don’t know what to do without you i don’t know what to do without you you, you, you you know i don’t know what to do i don’t know what to do without you i say i am fine but don’t know what to do without you i am left alone in this trivial place i picture your memories, they’re blue"
kill-this-love,"yeah, yeah, yeah blackpink in your area! yeah, yeah, yeah 1 after a sweet ""hi"", there's always a bitter ""bye"" after every crazy high, there’s a price you have to pay there’s no answer to this test i’ll always for it yes i’m a slave to my emotions screw this heartless love 2 here i come kick in the door give me the strongest one so obvious, that love give me more, give me some more cling onto the edge of the cliff if you want with just one word you're like starstruck again that warm nervous feeling, extreme excitement felt like heaven but you might not get in it look at me, look at you, who will be in more pain? you smart like who? you are if you cry tears of blood from both eyes so sorry like who? you are what should i do? i can’t stand myself being so weak while i force myself to cover my eyes i need to bring an end to this love let's kill this love! yeah, yeah, yeah, yeah, yeah rum, pum, pum, pum, pum, pum, pum let's kill this love! rum, pum, pum, pum, pum, pum, pum 3 feelin' like a sinner it's so fire with him i go boo, hoo he said ""you look crazy"" thank you baby i owe it to you got me messed up his love is my favorite but you plus me sadly can be dangerous lucky me, lucky you after in the end we lie so what? so what? if i end up forgetting you so sorry i'm not sorry what should i do? i can’t stand myself being so weak while i force myself to hide my tears i need to bring an end to this love let's kill this love! yeah, yeah, yeah, yeah, yeah rum, pum, pum, pum, pum, pum, pum let's kill this love! rum, pum, pum, pum, pum, pum, pum we commit to love that makes you cry, oh we're making love that kills you inside, yeah we must kill this love yeah, yeah yeah, it's sad but true gotta kill this love yeah, yeah before it kills you too kill this love yeah, yeah yeah, it's sad but true gotta kill this love yeah, yeah gotta kill, let's kill this love!"
boombayah,"hot blackpink in your area hot blackpink in your area 1 been a bad girl, i know i am and i’m so hot, i need a fan i don’t want a boy, i need a man 2 click-clack! badda bing badda booom! when i kick open the door, they look at me even if i don’t try that hard guys get nosebleeds pang-pang-parapara-pang-pang-pang a toast for me right now, clink, clink, clink hands up, in my hands there’s a bottle full o’ henny the girl you’ve always heard about, that’s me, 1 the dancing light wraps around me black to the pink wherever i am, i'm special, oh yes don’t care if you look or not, i wanna dance like ddaradaradanddan ddaradaradanddan ddudurupbaoo 2 i like it, i like this atmosphere i like it, i like you right now i’m for you tonight i wanna dance with you boombayah yah yah yah boombayah yah yah yah boombayah yah yah yah yah boom boom ba boom boom ba oppa yah yah yah yah yah yah yah yah yah yah yah yah yah yah yah yah yah yah yah yah oppa yah yah yah yah yah yah yah yah yah yah yah yah yah yah yah yah yah boom boom ba boombayah hot blackpink in your area 3 have to run now, what else would i do? i’m immature, i have no fear, man middle finger up f-u pay me 90's baby, i pump up the jam run, run, oppa lambo today, you and i are gambling with youth don’t you dare stop me, even if someone tries i’m gonna go brrrr, rambo 1 your hands wrap around my waist front to my back my body is special, oh yes your eyes say i know you wanna touch like touch, touch, touch touch ddudurupbaoo 2 i like it, i like this atmosphere i like it, i like you right now this night is awesome i wanna dance with you boombayah yah yah yah boombayah yah yah yah boombayah yah yah yah yah boom boom ba boom boom ba oppa yah yah yah yah yah yah yah yah yah yah yah yah yah yah yah yah yah yah yah yah oppa yah yah yah yah yah yah yah yah yah yah yah yah yah yah yah yah yah boom boom ba boombayah let’s not be sober today we’re get higher than the sky i wanna go fast, without knowing the end let’s go, let’s go let’s not be sober today we’re get higher than the sky i wanna go fast, without knowing the end let’s go, let’s go"
whistle,"hey boy make’ em whistle like a missile bomb bomb every time i show up blow up uh make’ em whistle like a missile bomb bomb every time i show up blow up uh you’re so beautiful i can’t forget you your eyes still make my heart flutter, boom boom 24 365 i only wanna be with you during the day and at night i want you like this, ooh ooh every guy checks me out every day they think they can get me i don’t want a lot of things i want your heart cut out your heart and show me confidently, sometimes chic chic so hot so hot make me not know what to do softly out to me like a whistle in my ear don’t pass me by if you can’t forget me either, whoa my heart for you is fire my heart is beating so fast you can hear it closer and closer whistle whistle whistle whistle can you hear that whistle whistle whistle whistle whistle whistle whistle can you hear that whistle whistle whistle hold up don’t say anything just whistle to my heart that sound makes my heart flutter boom boom thoughts are boring feelings are shh every day day only stay by my side zoom zoom uh i’m always stylin’ i’m chic but in front of you, darlin’ it’s getting hot like a desert island the more i get to know you, the more my heart rings stop hesitating, come over to me boy, it’s checkmate now i win this game uh-huh i choose you, i’ll hug you harder before someone takes you away don’t pass me by if you can’t forget me either, whoa my heart for you is fire my heart is beating so fast you can hear it closer and closer whistle whistle whistle whistle can you hear that whistle whistle whistle whistle whistle whistle whistle can you hear that whistle whistle whistle this beat got me feelin’ like i hope we won’t just pass by like the wind no need for many words just take me to your side make’ em whistle like a missile bomb bomb every time i show up blow up uh make’ em whistle like a missile bomb bomb every time i show up blow up uh"
playing-with-fire,"my mom told me every day to always be careful of guys because love is like playing with fire i’ll get hurt my mom might be right because when i see you, my heart gets hot because rather than fear my attraction to you is bigger i can’t stop this trembling on and on and on i wanna throw my into your world look at me look at me now you are burning me up like this i can’t turn it off our love that’s like playing with fire my love is on fire now burn baby burn playing with fire my love is on fire so don’t play with me boy playing with fire oh no, i’ve already come too far suddenly, none of this is a game anymore love is like red fire blow, wind, so the fire will grow is this medicine or poison? not even my mom knows there’s a robber in my heart but why don’t the police know? pour out your oil in my burning heart kiss him will i diss him i don’t know but i miss him this is past addiction, this love is crack the color of my heart is black i can’t stop this trembling on and on and on i wanna throw my into your fiery path look at me look at me now you are burning me up like this i can’t turn it off our love that’s like playing with fire my love is on fire now burn baby burn playing with fire my love is on fire so don’t play with me boy playing with fire i can’t control it this fire path is spreading too quickly don’t stop me so this love can burn up this night"
stay,"so easily, with harsh words you put scars in my heart without even saying sorry again, i’m comforting myself always nervous if you’re gonna leave me i just want you to stay in your expressionless face that’s getting more and more dull i whisper to the mirror, let’s slowly let this go you take me for granted but that’s you but still, stay stay stay with me this sad melody resembles you it makes me cry eh eh your scent is a sweet felony i hate you so much but i love you before the dark night traps me in don’t leave me do you still love me? if you feel the same, don’t leave today don’t ask why it has to be you just stay with me it goes a little something like i don’t expect a lot right now just stay with me there’s nothing more i want now i can’t even tell if my heart is beating rather than forceful conversations with others i’d rather be in awkward silence with you so stay, wherever that may be sometimes, when darkness comes, i’ll be your fire in this world that is a lie the only truth, it’s you this a letter from me to you this sad melody resembles you it makes me cry eh eh your scent is a sweet felony i hate you so much but i love you before the dark night traps me in don’t leave me do you still love me? if you feel the same, don’t leave today don’t ask why it has to be you just stay with me it goes a little something like i don’t expect a lot right now just stay with me it goes a little something like i don’t expect a lot right now just stay with me"
forever-young,"don’t go just stay let’s stop time now if i’m with you i could die in this moment forever young forever young forever young forever young 1 my reflection in your eyes i hope it’s always like the day we met like the flames that burn without a sound i hope you kiss me like it’s our last 2 under the moonlight my heart is fluttering let’s go dance under the milky way let’s go right now let go let’s have no regrets when today has gone by so that time can’t tear us apart so that this moment can be eternal you light a fire in my heart so that my youth without a regret is on fire if i’m with you like now tonight i could die in this moment forever young forever young forever young forever young every every night night i sing sing this song know we got that bomb bomb come again come again 3 forever young boy so we ride or die you and i ride endlessly under the red sunset you are by my side pinked out or murdered out like it ain’t no thing we need nothing, we are the protagonists say life’s a bish? but mine’s a movie like my diamond we’ll shine together whenever wherever forever ever ever 4 thrillingly, more dangerously will you go to the ends of the world, let’s go now let go let’s have no regrets when today has gone by so that time can’t tear us apart so that this moment can be eternal you light a fire in my heart so that my youth without a regret is on fire if i’m with you like now tonight i could die in this moment forever young blackpink is the revolution when the moon rises and the stars rise, we dance body let’s ride endlessly, we like to party when the moon rises and the stars rise, we dance body let’s ride endlessly, we like to party girls wanna have some fun we go dumb dumb dumb girls wanna have some fun what you want want want girls wanna have some fun we go dumb dumb dumb girls wanna have some fun we ain’t done done done whatta bum bum whatta bum bum whatta bum bum whatta bum bum whatta bum bum whatta bum bum whatta bum bum whatta bum bum whatta bum bum whatta bum bum whatta bum bum whatta bum bum whatta bum bum whatta bum bum whatta bum bum whatta bum bum"
see-u-later,"there's nothing to worry about i did it i do not like you anyway every time promises come back repeat countless times i gave you my heart so much, but no like an empty can yes your sorry now the dog is barking i looked up and started to think about everything i will throw you away next to her is a fool i will tell you today i do not want you no more hold up did you say you'll be eternal? but the conclusion is that you messed up you are a light ping pong i'm kicking you now ding dong playa you is not know? i picked the wrong person he should have looked at me and gave it to me like queen bee see u later boy see u later see u later boy see u later later see u later boy see u later would have could have should have didn’t see u later boy see u later see u later boy see u later later see u later boy see u later see u later maybe never the pea pod was peeled off it's useless to grab that's it. that's it now you are not got no best friend lonely weekend yeah you loser lonely loser ha ha like an empty can yes your sorry now the dog is barking when i look up, i see your faults i will throw you away next to her is a fool i will tell you today i do not want you no more as long as the pain was fast you went to the hook now i remember who i was i'm a boss bish you're right about that i already erased your phone number boomin back to the heart of boomin pedal to the metal like see u later boy see u later see u later boy see u later later see u later boy see u later would have could have should have didn’t see u later boy see u later see u later boy see u later later see u later boy see u later see u later maybe never goodbye baby why do not i do it when i'm by your side why do you wanna go and do that? you liked my back i remember seeing it right now bye bye bye bye bye see u later boy see u later see u later boy see u later later see u later boy see u later would have could have should have didn’t see u later boy see u later see u later boy see u later later see u later boy see u later see u later maybe never"
really,"if you love me i can not stand a day without you i want to stick with it if you want me different from the other guy 1 tell me i'll take the stars in the sky good when you do not have a lot of time tell her to look at another girl's view sometimes i want a lie that does not sound like a lie 2 a woman around you without a star stop and manage you're coming to me anyway better act like you know what better act like you know what eyes have been me baby body been tellin me take me boys have been sayin to date me your lips should be sayin the same thing for real what’s the deal got a feelin you feelin me aye but i don’t play with them fakes keep it real with me if you love me i can not stand a day without you i want to stick with it if you want me different from the other guy 3 i'll give you two if you give me one no, no if the two of you meet your eyes i was lonely yesterday because of you no more 4 do not chew on me even if i drink alcohol yeah do not believe my words, it's over now yeah it's not complicated. it's easy. 1, 2, 3 imagine if we could be one want a romance like the old times want to slow dance when it's show time just me and you, and that slow jam that playlist, my favorite, so play it, but baby f a love song i need you to say it, say it if you love me i can not stand a day without you i want to stick with it if you want me it's different from other men i gotta know that you’re for real i gotta know that you’re for real i gotta know that you’re for real i gotta know that you’re for real"
kick-it,"1 so what’s the answer so what are you going to do now i’ll break ya break your heart never asked for much don’t even try, oh 2 don’t pick up the words i just tossed around i ain’t nothin' like the same same girls that you’ve had yeah, i just do what i want the dark night might take me away but now i can dance for myself i’ll jump over the that is you i’ll kick it if you’re down kick it if you down can i kick it? yeah in the dark sky i’m going to cause a scene and light it on fire can i kick it? yeah i’m going to destroy the world that is you and shine brightly and i’m letting it out i have nothing to lose i’m going to find myself i’m okay being alone don’t feel bad for me i’m going to forget you now 3 never needed nothin’ else just a lil' love from myself when you couldn’t be the one to help had to kick it and i did it tell whoever you wanna tell get kicked to the curb, you're kicked out never kick a girl when she kicked down who you gon kiss now? know you gon miss how i move from the top to the bottom of my kicks now the dark night might take me away but now i can dance for myself i’ll jump over the that is you i’ll kick it if you’re down kick it if you down can i kick it? yeah in the dark sky i’m going to cause a scene and light it on fire can i kick it? yeah i’m going to destroy the world that is you and shine brightly and i’m letting it out i have nothing to lose i’m going to find myself i’m okay being alone don’t feel bad for me i’m going to forget you now so what’s the answer so what are you going to do now i’m leaving your frustrating world and flying above it i’ll kick it how i wanna kick it when i wanna kick it no, you can’t tell me not to kick it cause i’m bout to kick it i’ll kick it how i wanna kick it when i wanna kick it no, you can’t tell me not to kick it cause i’m about to kick it and i’m letting it out i have nothing to lose i’m going to find myself i’m okay being alone don’t feel bad for me i’m going to forget you now"
hope-not,"1 i sit by the window where cool air blows i think of you while looking at the far sky i must be a fool who can't be helped even when the four seasons change, i don’t they say there's no point in regretting but i'll keep thinking of you i was wrong i will smile if i see you as if nothing happened for you i’m okay with being hurt since i only gave you pain during the time we were together but you, the love you want you need to meet someone better than me and be happy but i hope not to the point where you forget me 2 i can't asleep this night under the moonlight no matter how much i wait, you won't come next to me is an empty space i'm not a stranger to being alone anymore they say there's no point in regretting but i'll keep thinking of you(i was wrong i will smile if i see you as if nothing happened for you i'm okay with being hurt since i only gave you pain during the time we were together but you, the love you want you need to meet someone better than me and be happy but i hope not to the point where you forget me yeah, yeah, yeah where you forget me yeah, yeah, yeah where you forget me yeah, yeah, yeah still at this place, i can't forget about you for you i’m okay with being hurt since i only gave you pain during the time we were together but you, the love you want you need to meet someone better than me and be happy but i hope not to the point where you forget me"
as-if-its-your-last,"little bit of that little bit of this little bit of that gimme gimme gimme gimme little bit of that 1 who are you to make me keep thinking of you? my pride is bruised, i’m burning up my face is hot, my heart keeps racing i can’t control my body, i’m getting dizzy 2 you’re like a fistful of sand it’s like i can hold you but i can’t you’re not easy, that’s why i want you more i can’t control my heart, it’s ridiculous can you feel my breath wanting you right now even when i’m looking at you i’m missing you i’m so bad at this, won’t you set me free baby, hold me till i explode stop thinking, what’s so hard about this? kiss me like it’s a lie as if i’m your last love hook as if it’s the last, as, as, as if it’s the last as if it’s the last night, love as if it’s the last, as, as, as if it’s the last as if there’s no tomorrow 3 uh i'ma in love baby you gon finna catch me uh give you of this baby me pretty and nasty 'cause we gonna get it my love you can bet it on black we gon double the stack on them whoa! i be the bonnie and you be my clyde we ride or die xs and os time is ticking i’m getting impatient only you are my world missing you i’m so bad at this, won’t you set me free baby, hold me till i explode stop thinking, what’s so hard about this? kiss me like it’s a lie as if i’m your last love hook as if it’s the last, as, as, as if it’s the last as if it’s the last night, love as if it’s the last, as, as, as if it’s the last as if there’s no tomorrow one two three it’s a new beginning because i won’t ever look back if i throw myself at you please catch me because the world can’t bring us down blackpink in your area baby, hold me till i explode stop thinking, what’s so hard about this? kiss me like it’s a lie as if i’m your last love hook as if it’s the last, as, as, as if it’s the last as if it’s the last night, love as if it’s the last, as, as, as if it’s the last as if there’s no tomorrow, love"
